{
  "manifestKey": "EM_KNOWLEDGE_POPULATION_V1",
  "version": "1.0.0",
  "scope": "CONTROLLED_EMERGENCY_MEDICATION_KNOWLEDGE_BATCH",
  "clinicalActivationAllowed": false,
  "providerFacingAlertsAllowed": false,
  "orderBlockingAllowed": false,
  "automaticApprovalAllowed": false,
  "fixtureMarker": null,
  "notes": "Phase 12 controlled EM knowledge population. Canonical concept IDs resolved at runtime against the live database. No fabricated approved clinical claims.",
  "families": [
    {
      "familyKey": "EM_FAM_ACETAMINOPHEN",
      "requestedFamilyName": "acetaminophen",
      "canonicalConceptId": null,
      "expectedProducts": [],
      "therapeuticClassKeys": [],
      "emergencyContexts": [
        "PAIN_MANAGEMENT",
        "INFECTION",
        "RESPIRATORY_DISTRESS"
      ],
      "requiredClinicalDomains": [
        "CLINICAL_PROFILE",
        "ADMINISTRATION",
        "CONTRAINDICATIONS",
        "EMERGENCY_MEDICINE_PROFILE"
      ],
      "requiredSafetyDomains": [
        "THERAPEUTIC_CLASS_MEMBERSHIP",
        "ACTIVE_INGREDIENT_ALLERGEN_MAPPING",
        "DUPLICATE_THERAPY_MEMBERSHIP"
      ],
      "priority": 1,
      "highAlertCandidate": false,
      "controlledSubstanceCandidate": false,
      "sourceVersionKeys": [
        "PHASE12_CLINICAL_FRAMEWORK_V1",
        "PHASE12_SAFETY_FRAMEWORK_V1"
      ],
      "contentFiles": [
        "phase12-clinical-intake.json",
        "phase12-safety-intake.json"
      ],
      "reviewRequirements": [
        "CLINICAL",
        "PHARMACIST"
      ],
      "populationWave": "WAVE_1",
      "domainApplicabilityNote": "Scaffolding only — clinical facts require approved labeled sources before approval."
    },
    {
      "familyKey": "EM_FAM_IBUPROFEN",
      "requestedFamilyName": "ibuprofen",
      "canonicalConceptId": null,
      "expectedProducts": [],
      "therapeuticClassKeys": [],
      "emergencyContexts": [
        "PAIN_MANAGEMENT",
        "INFECTION",
        "RESPIRATORY_DISTRESS"
      ],
      "requiredClinicalDomains": [
        "CLINICAL_PROFILE",
        "ADMINISTRATION",
        "CONTRAINDICATIONS",
        "EMERGENCY_MEDICINE_PROFILE"
      ],
      "requiredSafetyDomains": [
        "THERAPEUTIC_CLASS_MEMBERSHIP",
        "ACTIVE_INGREDIENT_ALLERGEN_MAPPING",
        "DUPLICATE_THERAPY_MEMBERSHIP"
      ],
      "priority": 2,
      "highAlertCandidate": false,
      "controlledSubstanceCandidate": false,
      "sourceVersionKeys": [
        "PHASE12_CLINICAL_FRAMEWORK_V1",
        "PHASE12_SAFETY_FRAMEWORK_V1"
      ],
      "contentFiles": [
        "phase12-clinical-intake.json",
        "phase12-safety-intake.json"
      ],
      "reviewRequirements": [
        "CLINICAL",
        "PHARMACIST"
      ],
      "populationWave": "WAVE_1",
      "domainApplicabilityNote": "Scaffolding only — clinical facts require approved labeled sources before approval."
    },
    {
      "familyKey": "EM_FAM_NAPROXEN",
      "requestedFamilyName": "naproxen",
      "canonicalConceptId": null,
      "expectedProducts": [],
      "therapeuticClassKeys": [],
      "emergencyContexts": [
        "PAIN_MANAGEMENT",
        "INFECTION",
        "RESPIRATORY_DISTRESS"
      ],
      "requiredClinicalDomains": [
        "CLINICAL_PROFILE",
        "ADMINISTRATION",
        "CONTRAINDICATIONS",
        "EMERGENCY_MEDICINE_PROFILE"
      ],
      "requiredSafetyDomains": [
        "THERAPEUTIC_CLASS_MEMBERSHIP",
        "ACTIVE_INGREDIENT_ALLERGEN_MAPPING",
        "DUPLICATE_THERAPY_MEMBERSHIP"
      ],
      "priority": 3,
      "highAlertCandidate": false,
      "controlledSubstanceCandidate": false,
      "sourceVersionKeys": [
        "PHASE12_CLINICAL_FRAMEWORK_V1",
        "PHASE12_SAFETY_FRAMEWORK_V1"
      ],
      "contentFiles": [
        "phase12-clinical-intake.json",
        "phase12-safety-intake.json"
      ],
      "reviewRequirements": [
        "CLINICAL",
        "PHARMACIST"
      ],
      "populationWave": "WAVE_4",
      "domainApplicabilityNote": "Scaffolding only — clinical facts require approved labeled sources before approval."
    },
    {
      "familyKey": "EM_FAM_ASPIRIN",
      "requestedFamilyName": "aspirin",
      "canonicalConceptId": null,
      "expectedProducts": [],
      "therapeuticClassKeys": [],
      "emergencyContexts": [
        "PAIN_MANAGEMENT",
        "INFECTION",
        "RESPIRATORY_DISTRESS"
      ],
      "requiredClinicalDomains": [
        "CLINICAL_PROFILE",
        "ADMINISTRATION",
        "CONTRAINDICATIONS",
        "EMERGENCY_MEDICINE_PROFILE"
      ],
      "requiredSafetyDomains": [
        "THERAPEUTIC_CLASS_MEMBERSHIP",
        "ACTIVE_INGREDIENT_ALLERGEN_MAPPING",
        "DUPLICATE_THERAPY_MEMBERSHIP"
      ],
      "priority": 4,
      "highAlertCandidate": false,
      "controlledSubstanceCandidate": false,
      "sourceVersionKeys": [
        "PHASE12_CLINICAL_FRAMEWORK_V1",
        "PHASE12_SAFETY_FRAMEWORK_V1"
      ],
      "contentFiles": [
        "phase12-clinical-intake.json",
        "phase12-safety-intake.json"
      ],
      "reviewRequirements": [
        "CLINICAL",
        "PHARMACIST"
      ],
      "populationWave": "WAVE_4",
      "domainApplicabilityNote": "Scaffolding only — clinical facts require approved labeled sources before approval."
    },
    {
      "familyKey": "EM_FAM_ONDANSETRON",
      "requestedFamilyName": "ondansetron",
      "canonicalConceptId": null,
      "expectedProducts": [],
      "therapeuticClassKeys": [],
      "emergencyContexts": [
        "PAIN_MANAGEMENT",
        "INFECTION",
        "RESPIRATORY_DISTRESS"
      ],
      "requiredClinicalDomains": [
        "CLINICAL_PROFILE",
        "ADMINISTRATION",
        "CONTRAINDICATIONS",
        "EMERGENCY_MEDICINE_PROFILE"
      ],
      "requiredSafetyDomains": [
        "THERAPEUTIC_CLASS_MEMBERSHIP",
        "ACTIVE_INGREDIENT_ALLERGEN_MAPPING",
        "DUPLICATE_THERAPY_MEMBERSHIP"
      ],
      "priority": 5,
      "highAlertCandidate": false,
      "controlledSubstanceCandidate": false,
      "sourceVersionKeys": [
        "PHASE12_CLINICAL_FRAMEWORK_V1",
        "PHASE12_SAFETY_FRAMEWORK_V1"
      ],
      "contentFiles": [
        "phase12-clinical-intake.json",
        "phase12-safety-intake.json"
      ],
      "reviewRequirements": [
        "CLINICAL",
        "PHARMACIST"
      ],
      "populationWave": "WAVE_1",
      "domainApplicabilityNote": "Scaffolding only — clinical facts require approved labeled sources before approval."
    },
    {
      "familyKey": "EM_FAM_METOCLOPRAMIDE",
      "requestedFamilyName": "metoclopramide",
      "canonicalConceptId": null,
      "expectedProducts": [],
      "therapeuticClassKeys": [],
      "emergencyContexts": [
        "PAIN_MANAGEMENT",
        "INFECTION",
        "RESPIRATORY_DISTRESS"
      ],
      "requiredClinicalDomains": [
        "CLINICAL_PROFILE",
        "ADMINISTRATION",
        "CONTRAINDICATIONS",
        "EMERGENCY_MEDICINE_PROFILE"
      ],
      "requiredSafetyDomains": [
        "THERAPEUTIC_CLASS_MEMBERSHIP",
        "ACTIVE_INGREDIENT_ALLERGEN_MAPPING",
        "DUPLICATE_THERAPY_MEMBERSHIP"
      ],
      "priority": 6,
      "highAlertCandidate": false,
      "controlledSubstanceCandidate": false,
      "sourceVersionKeys": [
        "PHASE12_CLINICAL_FRAMEWORK_V1",
        "PHASE12_SAFETY_FRAMEWORK_V1"
      ],
      "contentFiles": [
        "phase12-clinical-intake.json",
        "phase12-safety-intake.json"
      ],
      "reviewRequirements": [
        "CLINICAL",
        "PHARMACIST"
      ],
      "populationWave": "WAVE_4",
      "domainApplicabilityNote": "Scaffolding only — clinical facts require approved labeled sources before approval."
    },
    {
      "familyKey": "EM_FAM_PROMETHAZINE",
      "requestedFamilyName": "promethazine",
      "canonicalConceptId": null,
      "expectedProducts": [],
      "therapeuticClassKeys": [],
      "emergencyContexts": [
        "PAIN_MANAGEMENT",
        "INFECTION",
        "RESPIRATORY_DISTRESS"
      ],
      "requiredClinicalDomains": [
        "CLINICAL_PROFILE",
        "ADMINISTRATION",
        "CONTRAINDICATIONS",
        "EMERGENCY_MEDICINE_PROFILE"
      ],
      "requiredSafetyDomains": [
        "THERAPEUTIC_CLASS_MEMBERSHIP",
        "ACTIVE_INGREDIENT_ALLERGEN_MAPPING",
        "DUPLICATE_THERAPY_MEMBERSHIP"
      ],
      "priority": 7,
      "highAlertCandidate": false,
      "controlledSubstanceCandidate": false,
      "sourceVersionKeys": [
        "PHASE12_CLINICAL_FRAMEWORK_V1",
        "PHASE12_SAFETY_FRAMEWORK_V1"
      ],
      "contentFiles": [
        "phase12-clinical-intake.json",
        "phase12-safety-intake.json"
      ],
      "reviewRequirements": [
        "CLINICAL",
        "PHARMACIST"
      ],
      "populationWave": "WAVE_4",
      "domainApplicabilityNote": "Scaffolding only — clinical facts require approved labeled sources before approval."
    },
    {
      "familyKey": "EM_FAM_FAMOTIDINE",
      "requestedFamilyName": "famotidine",
      "canonicalConceptId": null,
      "expectedProducts": [],
      "therapeuticClassKeys": [],
      "emergencyContexts": [
        "PAIN_MANAGEMENT",
        "INFECTION",
        "RESPIRATORY_DISTRESS"
      ],
      "requiredClinicalDomains": [
        "CLINICAL_PROFILE",
        "ADMINISTRATION",
        "CONTRAINDICATIONS",
        "EMERGENCY_MEDICINE_PROFILE"
      ],
      "requiredSafetyDomains": [
        "THERAPEUTIC_CLASS_MEMBERSHIP",
        "ACTIVE_INGREDIENT_ALLERGEN_MAPPING",
        "DUPLICATE_THERAPY_MEMBERSHIP"
      ],
      "priority": 8,
      "highAlertCandidate": false,
      "controlledSubstanceCandidate": false,
      "sourceVersionKeys": [
        "PHASE12_CLINICAL_FRAMEWORK_V1",
        "PHASE12_SAFETY_FRAMEWORK_V1"
      ],
      "contentFiles": [
        "phase12-clinical-intake.json",
        "phase12-safety-intake.json"
      ],
      "reviewRequirements": [
        "CLINICAL",
        "PHARMACIST"
      ],
      "populationWave": "WAVE_1",